id,title,date,journal
1,a 44yearold man with erythema of the face diphenhydramine neck and chest weakness and palpitations,2019-01-01,journal of emergency nursing
2,an evaluation of benadryl pyribenzamine and other socalled diphenhydramine antihistaminic drugs in the treatment of allergy,2019-01-01,journal of emergency nursing
3,diphenhydramine hydrochloride helps symptoms of ciguatera fish poisoning,2019-02-01,the journal of pediatrics
4,tetracycline resistance patterns of lactobacillus buchneri group strains,2020-01-01,journal of food protection
5,appositional tetracycline bone formation rates in the beagle,2020-02-01,american journal of veterinary research
6,rapid reacquisition of contextual fear following extinction in mice effects of amount of extinction tetracycline acute ethanol withdrawal and ethanol intoxication,2020-01-01,psychopharmacology
7,the high cost of epinephrine autoinjectors and possible alternatives,2020-01-02,the journal of allergy and clinical immunology in practice
8,time to epinephrine treatment is associated with the risk of mortality in children who achieve sustained rosc after traumatic outofhospital cardiac arrest,2020-01-03,the journal of allergy and clinical immunology in practice
